{
  "Arn": "arn:aws:service:us-east-1:123456789012:resource/example",
  "CreationTime": "example-value",
  "HttpPackageConfigurations": "example-value",
  "LastModifiedTime": "example-value",
  "SourceLocationName": "example-resource",
  "Tags": "example-value",
  "VodSourceName": "example-resource"
}